{
  "schemaVersion": "1.0.0",
  "verifiedThrough": "2026-07-30",
  "sourceRecordCount": 163,
  "count": 28,
  "heldCount": 135,
  "records": [
    {
      "index": 9,
      "id": "sushi-zanmai",
      "name": "Sushizanmai Honten",
      "nameJa": "すしざんまい 本店",
      "branch": "Tsukiji honten",
      "neighborhood": "Tsukiji",
      "michelin": {
        "distinction": null,
        "edition": null,
        "verified": false,
        "sourceUrl": null
      },
      "lastVerified": "2026-07-30",
      "sources": [
        {
          "type": "official",
          "url": "https://www.kiyomura.co.jp/"
        },
        {
          "type": "tabelog",
          "url": "https://tabelog.com/tokyo/A1313/A131301/13002302/"
        }
      ]
    },
    {
      "index": 17,
      "id": "mutekiya",
      "name": "Mutekiya",
      "nameJa": "無敵家",
      "branch": "Ikebukuro",
      "neighborhood": "Ikebukuro",
      "michelin": {
        "distinction": null,
        "edition": null,
        "verified": false,
        "sourceUrl": null
      },
      "lastVerified": "2026-07-30",
      "sources": [
        {
          "type": "official",
          "url": "https://www.mutekiya.com/"
        },
        {
          "type": "tabelog",
          "url": "https://tabelog.com/tokyo/A1305/A130501/13003927/"
        }
      ]
    },
    {
      "index": 19,
      "id": "ippudo-ebisu",
      "name": "Ippudo Ebisu",
      "nameJa": "一風堂 恵比寿店",
      "branch": "Ebisu",
      "neighborhood": "Ebisu",
      "michelin": {
        "distinction": null,
        "edition": null,
        "verified": false,
        "sourceUrl": null
      },
      "lastVerified": "2026-07-30",
      "sources": [
        {
          "type": "official",
          "url": "https://stores.ippudo.com/"
        },
        {
          "type": "tabelog",
          "url": "https://tabelog.com/tokyo/A1303/A130302/13004461/"
        }
      ]
    },
    {
      "index": 24,
      "id": "ishikawa",
      "name": "Kagurazaka Ishikawa",
      "nameJa": "神楽坂 石かわ",
      "branch": "Kagurazaka",
      "neighborhood": "Kagurazaka",
      "michelin": {
        "distinction": "three_stars",
        "edition": 2026,
        "verified": true,
        "sourceUrl": "https://guide.michelin.com/gb/en/tokyo-region/tokyo/restaurant/kagurazaka-ishikawa"
      },
      "lastVerified": "2026-07-30",
      "sources": [
        {
          "type": "michelin",
          "url": "https://guide.michelin.com/gb/en/tokyo-region/tokyo/restaurant/kagurazaka-ishikawa"
        },
        {
          "type": "tabelog",
          "url": "https://tabelog.com/tokyo/A1309/A130905/13004079/"
        }
      ]
    },
    {
      "index": 29,
      "id": "tempura-kondo",
      "name": "Tempura Kondo",
      "nameJa": "てんぷら 近藤",
      "branch": "Ginza",
      "neighborhood": "Ginza",
      "michelin": {
        "distinction": "two_stars",
        "edition": 2026,
        "verified": true,
        "sourceUrl": "https://guide.michelin.com/en/tokyo-region/tokyo/restaurant/tempura-kondo"
      },
      "lastVerified": "2026-07-30",
      "sources": [
        {
          "type": "official",
          "url": "https://tempura-kondo.com/"
        },
        {
          "type": "michelin",
          "url": "https://guide.michelin.com/en/tokyo-region/tokyo/restaurant/tempura-kondo"
        },
        {
          "type": "tabelog",
          "url": "https://tabelog.com/tokyo/A1301/A130101/13004993/"
        }
      ]
    },
    {
      "index": 61,
      "id": "shirube",
      "name": "Shirube",
      "nameJa": "汁べゑ 下北沢店",
      "branch": "Shimokitazawa",
      "neighborhood": "Shimokitazawa",
      "michelin": {
        "distinction": null,
        "edition": null,
        "verified": false,
        "sourceUrl": null
      },
      "lastVerified": "2026-07-30",
      "sources": [
        {
          "type": "tabelog",
          "url": "https://tabelog.com/tokyo/A1318/A131802/13001398/"
        }
      ]
    },
    {
      "index": 74,
      "id": "ethiop",
      "name": "Curry Rice Ethiopia Honten",
      "nameJa": "カリーライス専門店エチオピア 本店",
      "branch": "Jimbocho honten",
      "neighborhood": "Jimbocho",
      "michelin": {
        "distinction": null,
        "edition": null,
        "verified": false,
        "sourceUrl": null
      },
      "lastVerified": "2026-07-30",
      "sources": [
        {
          "type": "official",
          "url": "https://www.ethiopia-curry.com/"
        },
        {
          "type": "tabelog",
          "url": "https://tabelog.com/tokyo/A1310/A131003/13000638/"
        }
      ]
    },
    {
      "index": 77,
      "id": "bondy",
      "name": "Bondy Jimbocho Honten",
      "nameJa": "欧風カレー ボンディ 神保町本店",
      "branch": "Jimbocho honten",
      "neighborhood": "Jimbocho",
      "michelin": {
        "distinction": null,
        "edition": null,
        "verified": false,
        "sourceUrl": null
      },
      "lastVerified": "2026-07-30",
      "sources": [
        {
          "type": "official",
          "url": "https://bondy.co.jp/"
        },
        {
          "type": "tabelog",
          "url": "https://tabelog.com/tokyo/A1310/A131003/13000439/"
        }
      ]
    },
    {
      "index": 78,
      "id": "delhi",
      "name": "Delhi Ueno",
      "nameJa": "デリー 上野店",
      "branch": "Ueno",
      "neighborhood": "Ueno",
      "michelin": {
        "distinction": null,
        "edition": null,
        "verified": false,
        "sourceUrl": null
      },
      "lastVerified": "2026-07-30",
      "sources": [
        {
          "type": "official",
          "url": "https://www.delhi.co.jp/"
        },
        {
          "type": "tabelog",
          "url": "https://tabelog.com/tokyo/A1311/A131101/13003605/"
        }
      ]
    },
    {
      "index": 79,
      "id": "sometaro",
      "name": "Sometaro",
      "nameJa": "風流お好み焼 染太郎",
      "branch": "Nishi-Asakusa",
      "neighborhood": "Nishi-Asakusa",
      "michelin": {
        "distinction": null,
        "edition": null,
        "verified": false,
        "sourceUrl": null
      },
      "lastVerified": "2026-07-30",
      "sources": [
        {
          "type": "official",
          "url": "https://www.sometaro.com/"
        },
        {
          "type": "tabelog",
          "url": "https://tabelog.com/tokyo/A1311/A131102/13003710/"
        }
      ]
    },
    {
      "index": 80,
      "id": "sakuratei",
      "name": "Sakura-tei",
      "nameJa": "さくら亭",
      "branch": "Harajuku",
      "neighborhood": "Harajuku",
      "michelin": {
        "distinction": null,
        "edition": null,
        "verified": false,
        "sourceUrl": null
      },
      "lastVerified": "2026-07-30",
      "sources": [
        {
          "type": "official",
          "url": "https://www.sakuratei.co.jp/"
        },
        {
          "type": "tabelog",
          "url": "https://tabelog.com/tokyo/A1306/A130601/13007421/"
        }
      ]
    },
    {
      "index": 86,
      "id": "rengatei",
      "name": "Rengatei",
      "nameJa": "煉瓦亭",
      "branch": "Rengatei",
      "neighborhood": "Ginza",
      "michelin": {
        "distinction": null,
        "edition": null,
        "verified": false,
        "sourceUrl": null
      },
      "lastVerified": "2026-07-30",
      "sources": [
        {
          "type": "tabelog",
          "url": "https://tabelog.com/tokyo/A1301/A130101/13002430/"
        }
      ]
    },
    {
      "index": 87,
      "id": "yoshikami",
      "name": "Yoshikami",
      "nameJa": "ヨシカミ",
      "branch": "Yoshikami",
      "neighborhood": "Asakusa",
      "michelin": {
        "distinction": null,
        "edition": null,
        "verified": false,
        "sourceUrl": null
      },
      "lastVerified": "2026-07-30",
      "sources": [
        {
          "type": "official",
          "url": "http://www.yoshikami.co.jp"
        },
        {
          "type": "tabelog",
          "url": "https://tabelog.com/tokyo/A1311/A131102/13003654/"
        }
      ]
    },
    {
      "index": 88,
      "id": "grill-grand",
      "name": "Grill Grand",
      "nameJa": "グリルグランド",
      "branch": "Grill Grand",
      "neighborhood": "Asakusa",
      "michelin": {
        "distinction": null,
        "edition": null,
        "verified": false,
        "sourceUrl": null
      },
      "lastVerified": "2026-07-30",
      "sources": [
        {
          "type": "tabelog",
          "url": "https://tabelog.com/tokyo/A1311/A131102/13008702/"
        }
      ]
    },
    {
      "index": 89,
      "id": "joel-robuchon",
      "name": "Gastronomie Joël Robuchon",
      "nameJa": "ガストロノミー ジョエル・ロブション",
      "branch": "Gastronomie Joël Robuchon",
      "neighborhood": "Ebisu / Mita",
      "michelin": {
        "distinction": "three_stars",
        "edition": 2026,
        "verified": true,
        "sourceUrl": "https://guide.michelin.com/jp/ja/tokyo-region/tokyo/restaurant/joel-robuchon-1193981"
      },
      "lastVerified": "2026-07-30",
      "sources": [
        {
          "type": "michelin",
          "url": "https://guide.michelin.com/jp/ja/tokyo-region/tokyo/restaurant/joel-robuchon-1193981"
        },
        {
          "type": "tabelog",
          "url": "https://tabelog.com/tokyo/A1303/A130302/13009310/"
        }
      ]
    },
    {
      "index": 92,
      "id": "narisawa",
      "name": "NARISAWA",
      "nameJa": "ナリサワ",
      "branch": "NARISAWA",
      "neighborhood": "Minami-Aoyama",
      "michelin": {
        "distinction": "two_stars",
        "edition": 2026,
        "verified": true,
        "sourceUrl": "https://guide.michelin.com/jp/ja/tokyo-region/tokyo/restaurant/narisawa"
      },
      "lastVerified": "2026-07-30",
      "sources": [
        {
          "type": "michelin",
          "url": "https://guide.michelin.com/jp/ja/tokyo-region/tokyo/restaurant/narisawa"
        }
      ]
    },
    {
      "index": 93,
      "id": "quintessence",
      "name": "Quintessence",